V1,V2,V3,V4,V5,V6,outage_num,cust_affected,time
events[0]=[063,04/18/2022 10:57 AM, 04/18/2022 10:57 AM, Waiting to be analyzed, , 1202526];,# of Outages: 5,Customers Affected: 37,2022-04-18T18:27:47Z
events[1]=[073,04/18/2022 09:34 AM, 04/18/2022 09:34 AM, A crew is currently working on the problem, 04/18/2022 03:00 PM, 1202519];,# of Outages: 5,Customers Affected: 37,2022-04-18T18:27:47Z
events[2]=[076,04/18/2022 01:13 PM, 04/18/2022 01:13 PM, The extent of the outage has been determined, , 1202535];,# of Outages: 5,Customers Affected: 37,2022-04-18T18:27:47Z
events[3]=[086,04/18/2022 10:04 AM, 04/18/2022 10:04 AM, A crew is currently working on the problem, 04/18/2022 02:00 PM, 1202523];,# of Outages: 5,Customers Affected: 37,2022-04-18T18:27:47Z
events[4]=[089,04/18/2022 11:32 AM, 04/18/2022 11:32 AM, A crew is currently working on the problem, 04/18/2022 06:00 PM, 1202528];,# of Outages: 5,Customers Affected: 37,2022-04-18T18:27:47Z
