V1,V2,V3,V4,V5,V6,outage_num,cust_affected,time
events[0]=[042,07/06/2022 12:00 AM, 07/06/2022 12:00 AM, A crew is currently working on the problem, 07/06/2022 03:00 AM, 1217232];,# of Outages: 6,Customers Affected: 239,2022-07-06T05:54:49Z
events[1]=[071,07/05/2022 11:20 PM, 07/05/2022 11:20 PM, Customer Svc is working this single customer outage, , 1217229];,# of Outages: 6,Customers Affected: 239,2022-07-06T05:54:49Z
events[2]=[072,07/05/2022 11:30 PM, 07/05/2022 11:30 PM, Customer Svc is working this single customer outage, , 1217230];,# of Outages: 6,Customers Affected: 239,2022-07-06T05:54:49Z
events[3]=[085,07/05/2022 04:05 PM, 07/05/2022 04:05 PM, Waiting for an available crew to perform repairs, 07/06/2022 02:00 AM, 1217110];,# of Outages: 6,Customers Affected: 239,2022-07-06T05:54:49Z
events[4]=[100,07/05/2022 08:07 PM, 07/05/2022 08:07 PM, Tree Trimming is clearing debris from the area, , 1217209];,# of Outages: 6,Customers Affected: 239,2022-07-06T05:54:49Z
events[5]=[118,07/05/2022 08:34 PM, 07/05/2022 08:34 PM, Waiting for an available crew to perform repairs, 07/06/2022 03:00 AM, 1217220];,# of Outages: 6,Customers Affected: 239,2022-07-06T05:54:49Z
