V1,V2,V3,V4,V5,V6,outage_num,cust_affected,time
events[0]=[035,11/02/2022 12:15 PM, 11/02/2022 12:15 PM, The extent of the outage has been determined, , 1237660];,# of Outages: 6,Customers Affected: 29,2022-11-02T17:19:51Z
events[1]=[062,11/02/2022 10:27 AM, 11/02/2022 10:27 AM, Trouble Shooter is determining repairs required, , 1237650];,# of Outages: 6,Customers Affected: 29,2022-11-02T17:19:51Z
events[2]=[073,11/02/2022 10:52 AM, 11/02/2022 10:52 AM, Trouble Shooter is working on the problem, 11/02/2022 12:30 PM, 1237653];,# of Outages: 6,Customers Affected: 29,2022-11-02T17:19:51Z
events[3]=[073,11/02/2022 11:47 AM, 11/02/2022 11:47 AM, A crew is currently working on the problem, 11/02/2022 04:30 PM, 1237657];,# of Outages: 6,Customers Affected: 29,2022-11-02T17:19:51Z
events[4]=[074,11/02/2022 12:04 PM, 11/02/2022 12:04 PM, Customer Svc is working this single customer outage, , 1237659];,# of Outages: 6,Customers Affected: 29,2022-11-02T17:19:51Z
events[5]=[102,11/02/2022 10:40 AM, 11/02/2022 10:40 AM, A crew is currently working on the problem, 11/02/2022 03:00 PM, 1237651];,# of Outages: 6,Customers Affected: 29,2022-11-02T17:19:51Z
