V1,V2,V3,V4,V5,V6,outage_num,cust_affected,time
events[0]=[050,08/06/2022 05:17 PM, 08/06/2022 05:17 PM, Waiting for an available crew to perform repairs, , 1223791];,# of Outages: 5,Customers Affected: 31,2022-08-07T10:43:56Z
events[1]=[085,08/06/2022 08:59 PM, 08/06/2022 08:59 PM, Waiting for an available crew to perform repairs, , 1223804];,# of Outages: 5,Customers Affected: 31,2022-08-07T10:43:56Z
events[2]=[086,08/07/2022 04:59 AM, 08/07/2022 04:59 AM, Trouble Shooter is determining repairs required, , 1223815];,# of Outages: 5,Customers Affected: 31,2022-08-07T10:43:56Z
events[3]=[097,08/07/2022 05:31 AM, 08/07/2022 05:31 AM, A crew is currently working on the problem, 08/07/2022 07:00 AM, 1223816];,# of Outages: 5,Customers Affected: 31,2022-08-07T10:43:56Z
events[4]=[098,07/31/2022 04:18 PM, 07/31/2022 04:18 PM, Waiting to be analyzed, , 1223032];,# of Outages: 5,Customers Affected: 31,2022-08-07T10:43:56Z
