V1,V2,V3,V4,V5,V6,outage_num,cust_affected,time
events[0]=[049,08/15/2022 02:53 PM, 08/15/2022 02:53 PM, Trouble Shooter is determining repairs required, , 1225547];,# of Outages: 7,Customers Affected: 65,2022-08-15T22:24:18Z
events[1]=[050,08/15/2022 12:04 PM, 08/15/2022 12:04 PM, Tree Trimming is clearing debris from the area, 08/15/2022 10:30 PM, 1225520];,# of Outages: 7,Customers Affected: 65,2022-08-15T22:24:18Z
events[2]=[084,08/15/2022 05:22 PM, 08/15/2022 05:22 PM, Waiting to be analyzed, , 1225562];,# of Outages: 7,Customers Affected: 65,2022-08-15T22:24:18Z
events[3]=[098,07/31/2022 04:18 PM, 07/31/2022 04:18 PM, Waiting to be analyzed, , 1223032];,# of Outages: 7,Customers Affected: 65,2022-08-15T22:24:18Z
events[4]=[099,08/15/2022 04:56 PM, 08/15/2022 04:56 PM, Customer Svc is working this single customer outage, , 1225561];,# of Outages: 7,Customers Affected: 65,2022-08-15T22:24:18Z
events[5]=[112,08/15/2022 02:34 AM, 08/15/2022 02:34 AM, A crew is currently working on the problem, 08/15/2022 10:30 PM, 1225449];,# of Outages: 7,Customers Affected: 65,2022-08-15T22:24:18Z
events[6]=[112,08/15/2022 06:45 AM, 08/15/2022 06:45 AM, A crew is currently working on the problem, 08/15/2022 10:30 PM, 1225459];,# of Outages: 7,Customers Affected: 65,2022-08-15T22:24:18Z
