V1,V2,V3,V4,V5,V6,outage_num,cust_affected,time
events[0]=[051,06/18/2022 08:39 AM, 06/18/2022 08:39 AM, The extent of the outage has been determined, , 1214850];,# of Outages: 6,Customers Affected: 62,2022-06-18T13:53:38Z
events[1]=[056,06/18/2022 02:23 AM, 06/18/2022 02:23 AM, A crew is currently working on the problem, 06/18/2022 12:30 PM, 1214831];,# of Outages: 6,Customers Affected: 62,2022-06-18T13:53:38Z
events[2]=[071,06/18/2022 08:38 AM, 06/18/2022 08:38 AM, The extent of the outage has been determined, , 1214849];,# of Outages: 6,Customers Affected: 62,2022-06-18T13:53:38Z
events[3]=[087,06/18/2022 06:47 AM, 06/18/2022 06:47 AM, Trouble Shooter is determining repairs required, , 1214834];,# of Outages: 6,Customers Affected: 62,2022-06-18T13:53:38Z
events[4]=[097,06/18/2022 07:25 AM, 06/18/2022 07:25 AM, Waiting to be analyzed, , 1214837];,# of Outages: 6,Customers Affected: 62,2022-06-18T13:53:38Z
events[5]=[114,06/18/2022 08:13 AM, 06/18/2022 08:13 AM, Trouble Shooter is determining repairs required, , 1214848];,# of Outages: 6,Customers Affected: 62,2022-06-18T13:53:38Z
