V1,V2,V3,V4,V5,V6,outage_num,cust_affected,time
events[0]=[050,06/18/2022 06:34 PM, 06/18/2022 06:34 PM, The extent of the outage has been determined, , 1214881];,# of Outages: 5,Customers Affected: 10,2022-06-18T23:53:37Z
events[1]=[073,06/18/2022 06:42 PM, 06/18/2022 06:42 PM, The extent of the outage has been determined, , 1214883];,# of Outages: 5,Customers Affected: 10,2022-06-18T23:53:37Z
events[2]=[083,06/18/2022 06:05 PM, 06/18/2022 06:05 PM, A crew is currently working on the problem, 06/18/2022 07:30 PM, 1214880];,# of Outages: 5,Customers Affected: 10,2022-06-18T23:53:37Z
events[3]=[099,06/18/2022 06:40 PM, 06/18/2022 06:40 PM, The extent of the outage has been determined, , 1214882];,# of Outages: 5,Customers Affected: 10,2022-06-18T23:53:37Z
events[4]=[101,06/18/2022 03:53 PM, 06/18/2022 03:53 PM, Waiting for an available crew to perform repairs, , 1214870];,# of Outages: 5,Customers Affected: 10,2022-06-18T23:53:37Z
