V1,V2,V3,V4,V5,V6,outage_num,cust_affected,time
events[0]=[072,07/02/2022 01:31 PM, 07/02/2022 01:31 PM, Trouble Shooter is determining repairs required, , 1216459];,# of Outages: 5,Customers Affected: 27,2022-07-02T19:39:10Z
events[1]=[073,07/02/2022 02:03 PM, 07/02/2022 02:03 PM, Waiting to be analyzed, , 1216461];,# of Outages: 5,Customers Affected: 27,2022-07-02T19:39:10Z
events[2]=[084,07/02/2022 08:46 AM, 07/02/2022 08:46 AM, A crew is currently working on the problem, 07/02/2022 06:00 PM, 1216427];,# of Outages: 5,Customers Affected: 27,2022-07-02T19:39:10Z
events[3]=[085,07/02/2022 08:54 AM, 07/02/2022 08:54 AM, Waiting for an available crew to perform repairs, , 1216432];,# of Outages: 5,Customers Affected: 27,2022-07-02T19:39:10Z
events[4]=[087,07/01/2022 11:18 PM, 07/01/2022 11:18 PM, A crew is currently working on the problem, 07/02/2022 04:00 PM, 1216405];,# of Outages: 5,Customers Affected: 27,2022-07-02T19:39:10Z
