V1,V2,V3,V4,V5,V6,outage_num,cust_affected,time
events[0]=[052,09/05/2022 07:37 AM, 09/05/2022 07:37 AM, A crew is currently working on the problem, 09/05/2022 04:00 PM, 1228362];,# of Outages: 4,Customers Affected: 211,2022-09-05T19:39:29Z
events[1]=[053,09/05/2022 07:37 AM, 09/05/2022 07:37 AM, A crew is currently working on the problem, 09/05/2022 04:00 PM, 1228362];,# of Outages: 4,Customers Affected: 211,2022-09-05T19:39:29Z
events[2]=[075,09/05/2022 01:26 PM, 09/05/2022 01:26 PM, Trouble Shooter is determining repairs required, , 1228431];,# of Outages: 4,Customers Affected: 211,2022-09-05T19:39:29Z
events[3]=[087,09/05/2022 09:36 AM, 09/05/2022 09:36 AM, A crew is currently working on the problem, 09/05/2022 05:30 PM, 1228404];,# of Outages: 4,Customers Affected: 211,2022-09-05T19:39:29Z
events[4]=[118,09/05/2022 09:37 AM, 09/05/2022 09:37 AM, Waiting for an available crew to perform repairs, , 1228407];,# of Outages: 4,Customers Affected: 211,2022-09-05T19:39:29Z
