V1,V2,V3,V4,V5,V6,outage_num,cust_affected,time
events[0]=[051,07/20/2022 06:15 AM, 07/20/2022 06:15 AM, Trouble Shooter is determining repairs required, , 1220502];,# of Outages: 7,Customers Affected: 136,2022-07-20T12:43:37Z
events[1]=[051,07/20/2022 06:25 AM, 07/20/2022 06:25 AM, Trouble Shooter is determining repairs required, , 1220505];,# of Outages: 7,Customers Affected: 136,2022-07-20T12:43:37Z
events[2]=[051,07/20/2022 07:09 AM, 07/20/2022 07:09 AM, Customer Svc is working this single customer outage, , 1220507];,# of Outages: 7,Customers Affected: 136,2022-07-20T12:43:37Z
events[3]=[052,07/20/2022 06:15 AM, 07/20/2022 06:15 AM, Trouble Shooter is determining repairs required, , 1220502];,# of Outages: 7,Customers Affected: 136,2022-07-20T12:43:37Z
events[4]=[073,07/19/2022 10:14 PM, 07/19/2022 10:14 PM, Trouble Shooter is determining repairs required, , 1220486];,# of Outages: 7,Customers Affected: 136,2022-07-20T12:43:37Z
events[5]=[073,07/20/2022 01:38 AM, 07/20/2022 01:38 AM, Trouble Shooter is working on the problem, 07/20/2022 08:30 AM, 1220496];,# of Outages: 7,Customers Affected: 136,2022-07-20T12:43:37Z
events[6]=[083,07/20/2022 03:40 AM, 07/20/2022 03:40 AM, A crew is currently working on the problem, 07/20/2022 08:30 AM, 1220498];,# of Outages: 7,Customers Affected: 136,2022-07-20T12:43:37Z
events[7]=[113,07/19/2022 10:37 PM, 07/19/2022 10:37 PM, Tree Trimming is clearing debris from the area, , 1220490];,# of Outages: 7,Customers Affected: 136,2022-07-20T12:43:37Z
