V1,V2,V3,V4,V5,V6,outage_num,cust_affected,time
events[0]=[002,04/21/2022 03:57 AM, 04/21/2022 03:57 AM, Waiting to be analyzed, , 1202795];,# of Outages: 5,Customers Affected: 89,2022-04-21T09:02:28Z
events[1]=[097,04/21/2022 03:38 AM, 04/21/2022 03:38 AM, Trouble Shooter is determining repairs required, , 1202791];,# of Outages: 5,Customers Affected: 89,2022-04-21T09:02:28Z
events[2]=[097,04/21/2022 03:41 AM, 04/21/2022 03:41 AM, Trouble Shooter is determining repairs required, , 1202794];,# of Outages: 5,Customers Affected: 89,2022-04-21T09:02:28Z
events[3]=[100,04/21/2022 02:43 AM, 04/21/2022 02:43 AM, A crew is currently working on the problem, 04/21/2022 04:00 AM, 1202790];,# of Outages: 5,Customers Affected: 89,2022-04-21T09:02:28Z
events[4]=[115,04/20/2022 09:05 PM, 04/20/2022 09:05 PM, Waiting for an available crew to perform repairs, , 1202785];,# of Outages: 5,Customers Affected: 89,2022-04-21T09:02:28Z
