V1,V2,V3,V4,V5,V6,outage_num,cust_affected,time
events[0]=[017,04/18/2022 07:26 AM, 04/18/2022 07:26 AM, A crew is currently working on the problem, 04/18/2022 01:00 PM, 1202510];,# of Outages: 6,Customers Affected: 33,2022-04-18T15:22:15Z
events[1]=[034,04/18/2022 09:41 AM, 04/18/2022 09:41 AM, A crew is currently working on the problem, 04/18/2022 01:00 PM, 1202520];,# of Outages: 6,Customers Affected: 33,2022-04-18T15:22:15Z
events[2]=[060,04/18/2022 09:54 AM, 04/18/2022 09:54 AM, Customer Svc is working this single customer outage, , 1202521];,# of Outages: 6,Customers Affected: 33,2022-04-18T15:22:15Z
events[3]=[073,04/18/2022 09:34 AM, 04/18/2022 09:34 AM, A crew is currently working on the problem, 04/18/2022 03:00 PM, 1202519];,# of Outages: 6,Customers Affected: 33,2022-04-18T15:22:15Z
events[4]=[086,04/18/2022 10:04 AM, 04/18/2022 10:04 AM, Trouble Shooter is determining repairs required, , 1202523];,# of Outages: 6,Customers Affected: 33,2022-04-18T15:22:15Z
events[5]=[114,04/18/2022 08:32 AM, 04/18/2022 08:32 AM, Tree Trimming is clearing debris from the area, 04/18/2022 12:00 PM, 1202514];,# of Outages: 6,Customers Affected: 33,2022-04-18T15:22:15Z
