V1,V2,V3,V4,V5,V6,outage_num,cust_affected,time
events[0]=[016,04/20/2022 06:26 PM, 04/20/2022 06:26 PM, Trouble Shooter is determining repairs required, , 1202782];,# of Outages: 5,Customers Affected: 34,2022-04-20T23:43:02Z
events[1]=[071,04/20/2022 06:19 PM, 04/20/2022 06:19 PM, Customer Svc is working this single customer outage, , 1202781];,# of Outages: 5,Customers Affected: 34,2022-04-20T23:43:02Z
events[2]=[087,04/20/2022 06:08 PM, 04/20/2022 06:08 PM, Customer Svc is working this single customer outage, , 1202780];,# of Outages: 5,Customers Affected: 34,2022-04-20T23:43:02Z
events[3]=[092,04/20/2022 01:11 PM, 04/20/2022 01:11 PM, A crew is currently working on the problem, 04/20/2022 07:00 PM, 1202761];,# of Outages: 5,Customers Affected: 34,2022-04-20T23:43:02Z
events[4]=[118,04/20/2022 06:28 PM, 04/20/2022 06:28 PM, Customer Svc is working this single customer outage, , 1202783];,# of Outages: 5,Customers Affected: 34,2022-04-20T23:43:02Z
