V1,V2,V3,V4,V5,V6,outage_num,cust_affected,time
events[0]=[040,04/03/2022 02:05 PM, 04/03/2022 02:05 PM, Waiting for an available crew to perform repairs, 04/03/2022 05:30 PM, 1199475];,# of Outages: 4,Customers Affected: 277,2022-04-03T21:40:48Z
events[1]=[051,04/03/2022 02:05 PM, 04/03/2022 02:05 PM, Waiting for an available crew to perform repairs, 04/03/2022 05:30 PM, 1199475];,# of Outages: 4,Customers Affected: 277,2022-04-03T21:40:48Z
events[2]=[053,04/03/2022 04:35 PM, 04/03/2022 04:35 PM, Waiting to be analyzed, , 1199491];,# of Outages: 4,Customers Affected: 277,2022-04-03T21:40:48Z
events[3]=[074,04/03/2022 03:41 PM, 04/03/2022 03:41 PM, Trouble Shooter is determining repairs required, , 1199490];,# of Outages: 4,Customers Affected: 277,2022-04-03T21:40:48Z
events[4]=[118,04/03/2022 02:52 PM, 04/03/2022 02:52 PM, A crew is currently working on the problem, 04/03/2022 06:00 PM, 1199488];,# of Outages: 4,Customers Affected: 277,2022-04-03T21:40:48Z
