V1,V2,V3,V4,V5,V6,outage_num,cust_affected,time
events[0]=[046,07/19/2022 07:37 PM, 07/19/2022 07:37 PM, A crew is currently working on the problem, 07/20/2022 02:00 AM, 1220477];,# of Outages: 5,Customers Affected: 43,2022-07-20T03:48:38Z
events[1]=[071,07/19/2022 10:16 PM, 07/19/2022 10:16 PM, Customer Svc is working this single customer outage, , 1220488];,# of Outages: 5,Customers Affected: 43,2022-07-20T03:48:38Z
events[2]=[073,07/19/2022 10:15 PM, 07/19/2022 10:15 PM, Waiting for an available crew to perform repairs, , 1220486];,# of Outages: 5,Customers Affected: 43,2022-07-20T03:48:38Z
events[3]=[099,07/19/2022 04:16 PM, 07/19/2022 04:16 PM, A crew is currently working on the problem, 07/19/2022 11:00 PM, 1220360];,# of Outages: 5,Customers Affected: 43,2022-07-20T03:48:38Z
events[4]=[113,07/19/2022 10:37 PM, 07/19/2022 10:37 PM, Waiting for an available crew to perform repairs, , 1220490];,# of Outages: 5,Customers Affected: 43,2022-07-20T03:48:38Z
