V1,V2,V3,V4,V5,V6,outage_num,cust_affected,time
events[0]=[062,06/18/2022 02:26 PM, 06/18/2022 02:26 PM, Trouble Shooter is determining repairs required, , 1214864];,# of Outages: 5,Customers Affected: 27,2022-06-18T21:53:28Z
events[1]=[064,06/18/2022 03:45 PM, 06/18/2022 03:45 PM, Customer Svc is working this single customer outage, , 1214869];,# of Outages: 5,Customers Affected: 27,2022-06-18T21:53:28Z
events[2]=[074,06/18/2022 10:21 AM, 06/18/2022 10:21 AM, Waiting to be analyzed, , 1214858];,# of Outages: 5,Customers Affected: 27,2022-06-18T21:53:28Z
events[3]=[082,06/18/2022 04:52 PM, 06/18/2022 04:52 PM, Waiting to be analyzed, , 1214874];,# of Outages: 5,Customers Affected: 27,2022-06-18T21:53:28Z
events[4]=[101,06/18/2022 03:53 PM, 06/18/2022 03:53 PM, Waiting to be analyzed, , 1214870];,# of Outages: 5,Customers Affected: 27,2022-06-18T21:53:28Z
