V1,V2,V3,V4,V5,V6,outage_num,cust_affected,time
events[0]=[040,07/16/2022 03:03 PM, 07/16/2022 03:03 PM, Trouble Shooter is determining repairs required, , 1219238];,# of Outages: 4,Customers Affected: 69,2022-07-16T20:42:39Z
events[1]=[051,07/16/2022 03:03 PM, 07/16/2022 03:03 PM, Trouble Shooter is determining repairs required, , 1219238];,# of Outages: 4,Customers Affected: 69,2022-07-16T20:42:39Z
events[2]=[063,07/16/2022 03:29 PM, 07/16/2022 03:29 PM, The extent of the outage has been determined, , 1219239];,# of Outages: 4,Customers Affected: 69,2022-07-16T20:42:39Z
events[3]=[084,07/16/2022 02:17 PM, 07/16/2022 02:17 PM, Trouble Shooter is determining repairs required, , 1219236];,# of Outages: 4,Customers Affected: 69,2022-07-16T20:42:39Z
events[4]=[085,07/16/2022 10:22 AM, 07/16/2022 10:22 AM, A crew is currently working on the problem, , 1219199];,# of Outages: 4,Customers Affected: 69,2022-07-16T20:42:39Z
