V1,V2,V3,V4,V5,V6,outage_num,cust_affected,time
events[0]=[050,06/18/2022 11:28 AM, 06/18/2022 11:28 AM, Waiting for an available crew to perform repairs, , 1214860];,# of Outages: 6,Customers Affected: 61,2022-06-18T17:32:29Z
events[1]=[050,06/18/2022 12:17 PM, 06/18/2022 12:17 PM, Trouble Shooter is determining repairs required, , 1214862];,# of Outages: 6,Customers Affected: 61,2022-06-18T17:32:29Z
events[2]=[056,06/18/2022 02:23 AM, 06/18/2022 02:23 AM, A crew is currently working on the problem, 06/18/2022 12:30 PM, 1214831];,# of Outages: 6,Customers Affected: 61,2022-06-18T17:32:29Z
events[3]=[056,06/18/2022 11:17 AM, 06/18/2022 11:17 AM, A crew is currently working on the problem, 06/18/2022 12:30 PM, 1214859];,# of Outages: 6,Customers Affected: 61,2022-06-18T17:32:29Z
events[4]=[074,06/18/2022 10:21 AM, 06/18/2022 10:21 AM, Waiting to be analyzed, , 1214858];,# of Outages: 6,Customers Affected: 61,2022-06-18T17:32:29Z
events[5]=[084,06/18/2022 09:30 AM, 06/18/2022 09:30 AM, A crew is currently working on the problem, 06/18/2022 02:30 PM, 1214857];,# of Outages: 6,Customers Affected: 61,2022-06-18T17:32:29Z
