V1,V2,V3,V4,V5,V6,outage_num,cust_affected,time
events[0]=[053,06/21/2022 06:12 PM, 06/21/2022 06:12 PM, A crew is currently working on the problem, 06/22/2022 01:00 AM, 1215228];,# of Outages: 5,Customers Affected: 78,2022-06-22T05:24:00Z
events[1]=[053,06/21/2022 08:00 PM, 06/21/2022 08:00 PM, A crew is currently working on the problem, 06/22/2022 01:00 AM, 1215237];,# of Outages: 5,Customers Affected: 78,2022-06-22T05:24:00Z
events[2]=[062,06/21/2022 09:54 PM, 06/21/2022 09:54 PM, Waiting for an available crew to perform repairs, , 1215240];,# of Outages: 5,Customers Affected: 78,2022-06-22T05:24:00Z
events[3]=[102,06/21/2022 07:04 AM, 06/21/2022 07:04 AM, A crew is currently working on the problem, 06/22/2022 12:30 AM, 1215144];,# of Outages: 5,Customers Affected: 78,2022-06-22T05:24:00Z
events[4]=[114,06/21/2022 08:41 PM, 06/21/2022 08:41 PM, Customer Svc is working this single customer outage, , 1215239];,# of Outages: 5,Customers Affected: 78,2022-06-22T05:24:00Z
