V1,V2,V3,V4,V5,V6,outage_num,cust_affected,time
events[0]=[008,04/18/2022 07:41 PM, 04/18/2022 07:41 PM, Waiting to be analyzed, , 1202570];,# of Outages: 5,Customers Affected: 43,2022-04-19T01:54:46Z
events[1]=[072,04/18/2022 08:37 PM, 04/18/2022 08:37 PM, Customer Svc is working this single customer outage, , 1202575];,# of Outages: 5,Customers Affected: 43,2022-04-19T01:54:46Z
events[2]=[098,04/18/2022 08:46 PM, 04/18/2022 08:46 PM, The extent of the outage has been determined, , 1202576];,# of Outages: 5,Customers Affected: 43,2022-04-19T01:54:46Z
events[3]=[101,04/18/2022 06:58 PM, 04/18/2022 06:58 PM, A crew is currently working on the problem, 04/19/2022 01:30 AM, 1202566];,# of Outages: 5,Customers Affected: 43,2022-04-19T01:54:46Z
events[4]=[102,04/18/2022 02:57 PM, 04/18/2022 02:57 PM, A crew is currently working on the problem, 04/19/2022 01:00 AM, 1202551];,# of Outages: 5,Customers Affected: 43,2022-04-19T01:54:46Z
