V1,V2,V3,V4,V5,V6,outage_num,cust_affected,time
events[0]=[049,08/26/2022 03:51 PM, 08/26/2022 03:51 PM, Waiting for an available crew to perform repairs, , 1226750];,# of Outages: 7,Customers Affected: 69,2022-08-27T05:09:06Z
events[1]=[050,08/26/2022 11:29 PM, 08/26/2022 11:29 PM, A crew is currently working on the problem, 08/27/2022 01:00 AM, 1226787];,# of Outages: 7,Customers Affected: 69,2022-08-27T05:09:06Z
events[2]=[051,08/26/2022 06:57 PM, 08/26/2022 06:57 PM, Waiting for an available crew to perform repairs, , 1226763];,# of Outages: 7,Customers Affected: 69,2022-08-27T05:09:06Z
events[3]=[088,08/26/2022 08:50 PM, 08/26/2022 08:50 PM, Waiting for an available crew to perform repairs, , 1226775];,# of Outages: 7,Customers Affected: 69,2022-08-27T05:09:06Z
events[4]=[102,08/26/2022 11:28 PM, 08/26/2022 11:28 PM, Trouble Shooter is determining repairs required, , 1226786];,# of Outages: 7,Customers Affected: 69,2022-08-27T05:09:06Z
events[5]=[112,08/26/2022 08:17 PM, 08/26/2022 08:17 PM, Customer Svc is working this single customer outage, , 1226774];,# of Outages: 7,Customers Affected: 69,2022-08-27T05:09:06Z
events[6]=[113,08/26/2022 06:52 PM, 08/26/2022 06:52 PM, Tree Trimming is clearing debris from the area, , 1226762];,# of Outages: 7,Customers Affected: 69,2022-08-27T05:09:06Z
