V1,V2,V3,V4,V5,V6,outage_num,cust_affected,time
events[0]=[037,04/18/2022 02:07 PM, 04/18/2022 02:07 PM, Trouble Shooter is determining repairs required, , 1202540];,# of Outages: 5,Customers Affected: 29,2022-04-18T22:43:48Z
events[1]=[061,04/18/2022 04:33 PM, 04/18/2022 04:33 PM, A crew is currently working on the problem, 04/18/2022 08:00 PM, 1202562];,# of Outages: 5,Customers Affected: 29,2022-04-18T22:43:48Z
events[2]=[085,04/18/2022 03:28 PM, 04/18/2022 03:28 PM, Trouble Shooter is determining repairs required, , 1202556];,# of Outages: 5,Customers Affected: 29,2022-04-18T22:43:48Z
events[3]=[098,04/18/2022 04:33 PM, 04/18/2022 04:33 PM, Customer Svc is working this single customer outage, , 1202563];,# of Outages: 5,Customers Affected: 29,2022-04-18T22:43:48Z
events[4]=[102,04/18/2022 02:57 PM, 04/18/2022 02:57 PM, Trouble Shooter is determining repairs required, , 1202551];,# of Outages: 5,Customers Affected: 29,2022-04-18T22:43:48Z
