V1,V2,V3,V4,V5,V6,outage_num,cust_affected,time
events[0]=[017,11/02/2022 01:59 PM, 11/02/2022 01:59 PM, Waiting for an available crew to perform repairs, 11/02/2022 03:00 PM, 1237701];,# of Outages: 7,Customers Affected: 10,2022-11-02T19:29:15Z
events[1]=[028,11/02/2022 01:00 PM, 11/02/2022 01:00 PM, Trouble Shooter is determining repairs required, , 1237661];,# of Outages: 7,Customers Affected: 10,2022-11-02T19:29:15Z
events[2]=[052,11/02/2022 02:23 PM, 11/02/2022 02:23 PM, Waiting to be analyzed, , 1237714];,# of Outages: 7,Customers Affected: 10,2022-11-02T19:29:15Z
events[3]=[064,11/02/2022 01:35 PM, 11/02/2022 01:35 PM, Trouble Shooter is determining repairs required, , 1237698];,# of Outages: 7,Customers Affected: 10,2022-11-02T19:29:15Z
events[4]=[073,11/02/2022 01:06 PM, 11/02/2022 01:06 PM, Waiting for an available crew to perform repairs, , 1237663];,# of Outages: 7,Customers Affected: 10,2022-11-02T19:29:15Z
events[5]=[076,11/02/2022 02:09 PM, 11/02/2022 02:09 PM, Customer Svc is working this single customer outage, , 1237710];,# of Outages: 7,Customers Affected: 10,2022-11-02T19:29:15Z
events[6]=[084,11/02/2022 01:05 PM, 11/02/2022 01:05 PM, A crew is currently working on the problem, 11/02/2022 05:30 PM, 1237662];,# of Outages: 7,Customers Affected: 10,2022-11-02T19:29:15Z
