V1,V2,V3,V4,V5,V6,outage_num,cust_affected,time
events[0]=[061,08/01/2022 09:45 PM, 08/01/2022 09:45 PM, Waiting for an available crew to perform repairs, , 1223164];,# of Outages: 5,Customers Affected: 45,2022-08-02T09:35:17Z
events[1]=[072,08/02/2022 04:22 AM, 08/02/2022 04:22 AM, The extent of the outage has been determined, , 1223174];,# of Outages: 5,Customers Affected: 45,2022-08-02T09:35:17Z
events[2]=[098,07/31/2022 04:18 PM, 07/31/2022 04:18 PM, Waiting to be analyzed, , 1223032];,# of Outages: 5,Customers Affected: 45,2022-08-02T09:35:17Z
events[3]=[113,08/02/2022 12:58 AM, 08/02/2022 12:58 AM, A crew is currently working on the problem, 08/02/2022 07:30 AM, 1223170];,# of Outages: 5,Customers Affected: 45,2022-08-02T09:35:17Z
events[4]=[118,08/02/2022 02:26 AM, 08/02/2022 02:26 AM, Trouble Shooter is determining repairs required, , 1223173];,# of Outages: 5,Customers Affected: 45,2022-08-02T09:35:17Z
