V1,V2,V3,V4,V5,V6,outage_num,cust_affected,time
events[0]=[073,05/26/2022 02:27 PM, 05/26/2022 02:27 PM, Waiting for an available crew to perform repairs, , 1209628];,# of Outages: 5,Customers Affected: 30,2022-05-26T23:43:07Z
events[1]=[084,05/26/2022 03:12 PM, 05/26/2022 03:12 PM, Trouble Shooter is determining repairs required, , 1209632];,# of Outages: 5,Customers Affected: 30,2022-05-26T23:43:07Z
events[2]=[085,05/26/2022 03:31 PM, 05/26/2022 03:31 PM, Waiting for an available crew to perform repairs, , 1209638];,# of Outages: 5,Customers Affected: 30,2022-05-26T23:43:07Z
events[3]=[086,05/26/2022 02:39 PM, 05/26/2022 02:39 PM, Tree Trimming is clearing debris from the area, , 1209630];,# of Outages: 5,Customers Affected: 30,2022-05-26T23:43:07Z
events[4]=[114,05/26/2022 06:24 PM, 05/26/2022 06:24 PM, Customer Svc is working this single customer outage, , 1209649];,# of Outages: 5,Customers Affected: 30,2022-05-26T23:43:07Z
