V1,V2,V3,V4,V5,V6,outage_num,cust_affected,time
events[0]=[049,09/09/2022 07:14 AM, 09/09/2022 07:14 AM, Customer Svc is working this single customer outage, , 1229104];,# of Outages: 5,Customers Affected: 15,2022-09-09T12:48:24Z
events[1]=[072,09/09/2022 06:29 AM, 09/09/2022 06:29 AM, Waiting for an available crew to perform repairs, , 1229102];,# of Outages: 5,Customers Affected: 15,2022-09-09T12:48:24Z
events[2]=[084,09/09/2022 04:02 AM, 09/09/2022 04:02 AM, Waiting for an available crew to perform repairs, , 1229099];,# of Outages: 5,Customers Affected: 15,2022-09-09T12:48:24Z
events[3]=[088,09/09/2022 01:22 AM, 09/09/2022 01:22 AM, A crew is currently working on the problem, 09/09/2022 10:00 AM, 1229092];,# of Outages: 5,Customers Affected: 15,2022-09-09T12:48:24Z
events[4]=[118,09/09/2022 01:10 AM, 09/09/2022 01:10 AM, A crew is currently working on the problem, 09/09/2022 09:30 AM, 1229091];,# of Outages: 5,Customers Affected: 15,2022-09-09T12:48:24Z
