V1,V2,V3,V4,V5,V6,outage_num,cust_affected,time
events[0]=[049,06/28/2022 01:29 PM, 06/28/2022 01:29 PM, A crew is currently working on the problem, 06/28/2022 11:30 PM, 1216046];,# of Outages: 5,Customers Affected: 22,2022-06-29T03:53:07Z
events[1]=[049,06/28/2022 12:46 PM, 06/28/2022 12:46 PM, A crew is currently working on the problem, 06/28/2022 11:30 PM, 1216041];,# of Outages: 5,Customers Affected: 22,2022-06-29T03:53:07Z
events[2]=[051,06/28/2022 10:36 PM, 06/28/2022 10:36 PM, The extent of the outage has been determined, , 1216115];,# of Outages: 5,Customers Affected: 22,2022-06-29T03:53:07Z
events[3]=[060,06/28/2022 09:44 PM, 06/28/2022 09:44 PM, Customer Svc is working this single customer outage, , 1216114];,# of Outages: 5,Customers Affected: 22,2022-06-29T03:53:07Z
events[4]=[101,06/28/2022 02:04 PM, 06/28/2022 02:04 PM, A crew is currently working on the problem, 06/28/2022 11:00 PM, 1216050];,# of Outages: 5,Customers Affected: 22,2022-06-29T03:53:07Z
