V1,V2,V3,V4,V5,V6,outage_num,cust_affected,time
events[0]=[071,03/17/2022 01:17 PM, 03/17/2022 01:17 PM, A crew is currently working on the problem, 03/17/2022 05:00 PM, 1196797];,# of Outages: 5,Customers Affected: 60,2022-03-17T19:26:51Z
events[1]=[073,03/17/2022 01:20 PM, 03/17/2022 01:20 PM, A crew is currently working on the problem, 03/17/2022 04:00 PM, 1196798];,# of Outages: 5,Customers Affected: 60,2022-03-17T19:26:51Z
events[2]=[073,03/17/2022 12:04 PM, 03/17/2022 12:04 PM, A crew is currently working on the problem, 03/17/2022 04:00 PM, 1196792];,# of Outages: 5,Customers Affected: 60,2022-03-17T19:26:51Z
events[3]=[085,03/17/2022 11:13 AM, 03/17/2022 11:13 AM, Tree Trimming is clearing debris from the area, 03/17/2022 03:30 PM, 1196786];,# of Outages: 5,Customers Affected: 60,2022-03-17T19:26:51Z
events[4]=[113,03/17/2022 02:04 PM, 03/17/2022 02:04 PM, Waiting for an available crew to perform repairs, , 1196799];,# of Outages: 5,Customers Affected: 60,2022-03-17T19:26:51Z
