V1,V2,V3,V4,V5,V6,outage_num,cust_affected,time
events[0]=[009,09/20/2022 11:13 AM, 09/20/2022 11:13 AM, Trouble Shooter is determining repairs required, , 1230276];,# of Outages: 7,Customers Affected: 413,2022-09-20T18:31:19Z
events[1]=[017,09/20/2022 12:39 PM, 09/20/2022 12:39 PM, A crew is currently working on the problem, 09/20/2022 02:30 PM, 1230293];,# of Outages: 7,Customers Affected: 413,2022-09-20T18:31:19Z
events[2]=[051,09/20/2022 09:12 AM, 09/20/2022 09:12 AM, A crew is currently working on the problem, 09/20/2022 03:00 PM, 1230261];,# of Outages: 7,Customers Affected: 413,2022-09-20T18:31:19Z
events[3]=[063,09/20/2022 01:25 PM, 09/20/2022 01:25 PM, Waiting to be analyzed, , 1230298];,# of Outages: 7,Customers Affected: 413,2022-09-20T18:31:19Z
events[4]=[072,09/20/2022 01:15 PM, 09/20/2022 01:15 PM, The extent of the outage has been determined, , 1230297];,# of Outages: 7,Customers Affected: 413,2022-09-20T18:31:19Z
events[5]=[072,09/20/2022 12:25 PM, 09/20/2022 12:25 PM, Waiting for an available crew to perform repairs, , 1230288];,# of Outages: 7,Customers Affected: 413,2022-09-20T18:31:19Z
events[6]=[086,09/20/2022 07:59 AM, 09/20/2022 07:59 AM, A crew is currently working on the problem, 09/20/2022 03:00 PM, 1230246];,# of Outages: 7,Customers Affected: 413,2022-09-20T18:31:19Z
