V1,V2,V3,V4,V5,V6,outage_num,cust_affected,time
events[0]=[072,11/13/2022 03:01 PM, 11/13/2022 03:01 PM, Trouble Shooter is determining repairs required, , 1239544];,# of Outages: 8,Customers Affected: 27,2022-11-13T21:32:23Z
events[1]=[073,11/13/2022 01:41 PM, 11/13/2022 01:41 PM, Trouble Shooter is determining repairs required, , 1239537];,# of Outages: 8,Customers Affected: 27,2022-11-13T21:32:23Z
events[2]=[074,11/13/2022 12:46 PM, 11/13/2022 12:46 PM, A crew is currently working on the problem, 11/13/2022 06:00 PM, 1239531];,# of Outages: 8,Customers Affected: 27,2022-11-13T21:32:23Z
events[3]=[083,11/12/2022 03:04 PM, 11/12/2022 03:04 PM, Waiting for an available crew to perform repairs, , 1239485];,# of Outages: 8,Customers Affected: 27,2022-11-13T21:32:23Z
events[4]=[099,11/13/2022 02:31 PM, 11/13/2022 02:31 PM, Customer Svc is working this single customer outage, , 1239541];,# of Outages: 8,Customers Affected: 27,2022-11-13T21:32:23Z
events[5]=[102,11/13/2022 03:17 PM, 11/13/2022 03:17 PM, Waiting to be analyzed, , 1239546];,# of Outages: 8,Customers Affected: 27,2022-11-13T21:32:23Z
events[6]=[114,11/13/2022 02:55 PM, 11/13/2022 02:55 PM, Trouble Shooter is determining repairs required, , 1239543];,# of Outages: 8,Customers Affected: 27,2022-11-13T21:32:23Z
events[7]=[118,11/13/2022 03:10 PM, 11/13/2022 03:10 PM, Customer Svc is working this single customer outage, , 1239545];,# of Outages: 8,Customers Affected: 27,2022-11-13T21:32:23Z
