V1,V2,V3,V4,V5,V6,outage_num,cust_affected,time
events[0]=[051,07/04/2022 10:07 PM, 07/04/2022 10:07 PM, A crew is currently working on the problem, , 1217027];,# of Outages: 5,Customers Affected: 41,2022-07-05T07:20:22Z
events[1]=[051,07/05/2022 01:03 AM, 07/05/2022 01:03 AM, Trouble Shooter is determining repairs required, , 1217035];,# of Outages: 5,Customers Affected: 41,2022-07-05T07:20:22Z
events[2]=[071,07/05/2022 12:42 AM, 07/05/2022 12:42 AM, Waiting for an available crew to perform repairs, , 1217032];,# of Outages: 5,Customers Affected: 41,2022-07-05T07:20:22Z
events[3]=[085,07/05/2022 12:06 AM, 07/05/2022 12:06 AM, A crew is currently working on the problem, 07/05/2022 03:30 AM, 1217031];,# of Outages: 5,Customers Affected: 41,2022-07-05T07:20:22Z
events[4]=[086,07/04/2022 07:58 PM, 07/04/2022 07:58 PM, Trouble Shooter is determining repairs required, , 1217024];,# of Outages: 5,Customers Affected: 41,2022-07-05T07:20:22Z
