V1,V2,V3,V4,V5,V6,outage_num,cust_affected,time
events[0]=[017,10/04/2022 01:54 PM, 10/04/2022 01:54 PM, Trouble Shooter is determining repairs required, , 1233071];,# of Outages: 6,Customers Affected: 10,2022-10-04T19:48:02Z
events[1]=[072,10/04/2022 02:26 PM, 10/04/2022 02:26 PM, The extent of the outage has been determined, , 1233073];,# of Outages: 6,Customers Affected: 10,2022-10-04T19:48:02Z
events[2]=[073,10/04/2022 02:26 PM, 10/04/2022 02:26 PM, Customer Svc is working this single customer outage, , 1233072];,# of Outages: 6,Customers Affected: 10,2022-10-04T19:48:02Z
events[3]=[085,10/04/2022 12:55 PM, 10/04/2022 12:55 PM, Customer Svc is working this single customer outage, , 1233065];,# of Outages: 6,Customers Affected: 10,2022-10-04T19:48:02Z
events[4]=[087,10/04/2022 01:30 PM, 10/04/2022 01:30 PM, A crew is currently working on the problem, 10/04/2022 04:30 PM, 1233069];,# of Outages: 6,Customers Affected: 10,2022-10-04T19:48:02Z
events[5]=[098,10/04/2022 02:35 PM, 10/04/2022 02:35 PM, The extent of the outage has been determined, , 1233074];,# of Outages: 6,Customers Affected: 10,2022-10-04T19:48:02Z
