V1,V2,V3,V4,V5,V6,outage_num,cust_affected,time
events[0]=[027,03/20/2022 06:58 PM, 03/20/2022 06:58 PM, Trouble Shooter is determining repairs required, , 1197181];,# of Outages: 8,Customers Affected: 53,2022-03-21T01:25:30Z
events[1]=[062,03/20/2022 12:48 PM, 03/20/2022 12:48 PM, A crew is currently working on the problem, 03/20/2022 09:30 PM, 1197159];,# of Outages: 8,Customers Affected: 53,2022-03-21T01:25:30Z
events[2]=[067,03/20/2022 04:43 PM, 03/20/2022 04:43 PM, A crew is currently working on the problem, 03/20/2022 09:30 PM, 1197173];,# of Outages: 8,Customers Affected: 53,2022-03-21T01:25:30Z
events[3]=[071,03/20/2022 04:04 PM, 03/20/2022 04:04 PM, Waiting for an available crew to perform repairs, , 1197170];,# of Outages: 8,Customers Affected: 53,2022-03-21T01:25:30Z
events[4]=[072,03/20/2022 06:37 PM, 03/20/2022 06:37 PM, Tree Trimming is clearing debris from the area, , 1197179];,# of Outages: 8,Customers Affected: 53,2022-03-21T01:25:30Z
events[5]=[072,03/20/2022 08:11 PM, 03/20/2022 08:11 PM, The extent of the outage has been determined, , 1197182];,# of Outages: 8,Customers Affected: 53,2022-03-21T01:25:30Z
events[6]=[103,03/20/2022 05:32 PM, 03/20/2022 05:32 PM, A crew is currently working on the problem, , 1197176];,# of Outages: 8,Customers Affected: 53,2022-03-21T01:25:30Z
events[7]=[103,03/20/2022 06:20 PM, 03/20/2022 06:20 PM, A crew is currently working on the problem, , 1197178];,# of Outages: 8,Customers Affected: 53,2022-03-21T01:25:30Z
