V1,V2,V3,V4,V5,V6,outage_num,cust_affected,time
events[0]=[062,06/04/2022 11:49 AM, 06/04/2022 11:49 AM, Customer Svc is working this single customer outage, , 1211533];,# of Outages: 5,Customers Affected: 17,2022-06-04T17:19:14Z
events[1]=[063,06/04/2022 09:30 AM, 06/04/2022 09:30 AM, Waiting for an available crew to perform repairs, , 1211530];,# of Outages: 5,Customers Affected: 17,2022-06-04T17:19:14Z
events[2]=[064,06/04/2022 09:33 AM, 06/04/2022 09:33 AM, A crew is currently working on the problem, 06/04/2022 03:30 PM, 1211531];,# of Outages: 5,Customers Affected: 17,2022-06-04T17:19:14Z
events[3]=[089,06/04/2022 08:55 AM, 06/04/2022 08:55 AM, Waiting for an available crew to perform repairs, , 1211527];,# of Outages: 5,Customers Affected: 17,2022-06-04T17:19:14Z
events[4]=[101,06/04/2022 10:16 AM, 06/04/2022 10:16 AM, A crew is currently working on the problem, 06/04/2022 07:00 PM, 1211532];,# of Outages: 5,Customers Affected: 17,2022-06-04T17:19:14Z
