V1,V2,V3,V4,V5,V6,outage_num,cust_affected,time
events[0]=[060,03/20/2022 01:57 PM, 03/20/2022 01:57 PM, A crew is currently working on the problem, 03/20/2022 06:00 PM, 1197163];,# of Outages: 5,Customers Affected: 15,2022-03-20T22:20:26Z
events[1]=[062,03/20/2022 12:48 PM, 03/20/2022 12:48 PM, Waiting for an available crew to perform repairs, , 1197159];,# of Outages: 5,Customers Affected: 15,2022-03-20T22:20:26Z
events[2]=[067,03/20/2022 04:43 PM, 03/20/2022 04:43 PM, Customer Svc is working this single customer outage, , 1197173];,# of Outages: 5,Customers Affected: 15,2022-03-20T22:20:26Z
events[3]=[071,03/20/2022 04:04 PM, 03/20/2022 04:04 PM, Waiting for an available crew to perform repairs, , 1197170];,# of Outages: 5,Customers Affected: 15,2022-03-20T22:20:26Z
events[4]=[083,03/20/2022 04:27 PM, 03/20/2022 04:27 PM, Customer Svc is working this single customer outage, , 1197172];,# of Outages: 5,Customers Affected: 15,2022-03-20T22:20:26Z
