V1,V2,V3,V4,V5,V6,outage_num,cust_affected,time
events[0]=[017,04/24/2022 01:27 AM, 04/24/2022 01:27 AM, Waiting for an available crew to perform repairs, , 1203624];,# of Outages: 4,Customers Affected: 236,2022-04-24T10:23:38Z
events[1]=[083,04/24/2022 05:13 AM, 04/24/2022 05:13 AM, The extent of the outage has been determined, , 1203648];,# of Outages: 4,Customers Affected: 236,2022-04-24T10:23:38Z
events[2]=[085,04/24/2022 03:07 AM, 04/24/2022 03:07 AM, A crew is currently working on the problem, 04/24/2022 05:30 AM, 1203643];,# of Outages: 4,Customers Affected: 236,2022-04-24T10:23:38Z
events[3]=[103,04/24/2022 12:03 AM, 04/24/2022 12:03 AM, Waiting for an available crew to perform repairs, , 1203621];,# of Outages: 4,Customers Affected: 236,2022-04-24T10:23:38Z
events[4]=[104,04/24/2022 12:03 AM, 04/24/2022 12:03 AM, Waiting for an available crew to perform repairs, , 1203621];,# of Outages: 4,Customers Affected: 236,2022-04-24T10:23:38Z
