V1,V2,V3,V4,V5,V6,outage_num,cust_affected,time
events[0]=[051,04/01/2022 02:56 PM, 04/01/2022 02:56 PM, Tree Trimming is clearing debris from the area, , 1199284];,# of Outages: 6,Customers Affected: 43,2022-04-01T23:34:33Z
events[1]=[072,04/01/2022 03:45 PM, 04/01/2022 03:45 PM, A crew is currently working on the problem, , 1199291];,# of Outages: 6,Customers Affected: 43,2022-04-01T23:34:33Z
events[2]=[073,04/01/2022 05:17 PM, 04/01/2022 05:17 PM, Trouble Shooter is determining repairs required, , 1199297];,# of Outages: 6,Customers Affected: 43,2022-04-01T23:34:33Z
events[3]=[084,04/01/2022 06:26 PM, 04/01/2022 06:26 PM, The extent of the outage has been determined, , 1199303];,# of Outages: 6,Customers Affected: 43,2022-04-01T23:34:33Z
events[4]=[102,04/01/2022 05:47 PM, 04/01/2022 05:47 PM, Customer Svc is working this single customer outage, , 1199300];,# of Outages: 6,Customers Affected: 43,2022-04-01T23:34:33Z
events[5]=[118,04/01/2022 04:58 PM, 04/01/2022 04:58 PM, Waiting for an available crew to perform repairs, , 1199296];,# of Outages: 6,Customers Affected: 43,2022-04-01T23:34:33Z
