V1,V2,V3,V4,V5,V6,outage_num,cust_affected,time
events[0]=[038,04/08/2022 12:54 PM, 04/08/2022 12:54 PM, A crew is currently working on the problem, 04/08/2022 05:30 PM, 1200060];,# of Outages: 6,Customers Affected: 45,2022-04-08T18:56:06Z
events[1]=[049,04/08/2022 01:35 PM, 04/08/2022 01:35 PM, Trouble Shooter is determining repairs required, , 1200063];,# of Outages: 6,Customers Affected: 45,2022-04-08T18:56:06Z
events[2]=[052,04/08/2022 01:40 PM, 04/08/2022 01:40 PM, Customer Svc is working this single customer outage, , 1200064];,# of Outages: 6,Customers Affected: 45,2022-04-08T18:56:06Z
events[3]=[072,04/08/2022 12:39 PM, 04/08/2022 12:39 PM, Trouble Shooter is determining repairs required, , 1200059];,# of Outages: 6,Customers Affected: 45,2022-04-08T18:56:06Z
events[4]=[083,04/08/2022 01:46 PM, 04/08/2022 01:46 PM, The extent of the outage has been determined, , 1200065];,# of Outages: 6,Customers Affected: 45,2022-04-08T18:56:06Z
events[5]=[116,04/08/2022 01:09 PM, 04/08/2022 01:09 PM, Trouble Shooter is determining repairs required, , 1200062];,# of Outages: 6,Customers Affected: 45,2022-04-08T18:56:06Z
