V1,V2,V3,V4,V5,V6,outage_num,cust_affected,time
events[0]=[050,11/08/2022 11:34 AM, 11/08/2022 11:34 AM, Tree Trimming is clearing debris from the area, , 1239022];,# of Outages: 5,Customers Affected: 12,2022-11-08T21:53:43Z
events[1]=[052,11/08/2022 10:55 AM, 11/08/2022 10:55 AM, A crew is currently working on the problem, 11/08/2022 05:30 PM, 1239014];,# of Outages: 5,Customers Affected: 12,2022-11-08T21:53:43Z
events[2]=[061,11/08/2022 12:27 PM, 11/08/2022 12:27 PM, Trouble Shooter is determining repairs required, , 1239031];,# of Outages: 5,Customers Affected: 12,2022-11-08T21:53:43Z
events[3]=[083,11/08/2022 03:40 PM, 11/08/2022 03:40 PM, The extent of the outage has been determined, , 1239061];,# of Outages: 5,Customers Affected: 12,2022-11-08T21:53:43Z
events[4]=[101,11/08/2022 03:39 PM, 11/08/2022 03:39 PM, The extent of the outage has been determined, , 1239060];,# of Outages: 5,Customers Affected: 12,2022-11-08T21:53:43Z
