V1,V2,V3,V4,V5,V6,outage_num,cust_affected,time
events[0]=[042,06/09/2022 09:07 PM, 06/09/2022 09:07 PM, Customer Svc is working this single customer outage, , 1213363];,# of Outages: 5,Customers Affected: 22,2022-06-10T11:18:52Z
events[1]=[072,06/10/2022 06:06 AM, 06/10/2022 06:06 AM, Waiting for an available crew to perform repairs, , 1213441];,# of Outages: 5,Customers Affected: 22,2022-06-10T11:18:52Z
events[2]=[101,06/09/2022 10:31 PM, 06/09/2022 10:31 PM, Customer Svc is working this single customer outage, , 1213409];,# of Outages: 5,Customers Affected: 22,2022-06-10T11:18:52Z
events[3]=[123,06/10/2022 01:50 AM, 06/10/2022 01:50 AM, Tree Trimming is clearing debris from the area, , 1213435];,# of Outages: 5,Customers Affected: 22,2022-06-10T11:18:52Z
events[4]=[123,06/10/2022 03:01 AM, 06/10/2022 03:01 AM, Tree Trimming is clearing debris from the area, , 1213438];,# of Outages: 5,Customers Affected: 22,2022-06-10T11:18:52Z
