V1,V2,V3,V4,V5,V6,outage_num,cust_affected,time
events[0]=[063,07/27/2022 08:49 PM, 07/27/2022 08:49 PM, Tree Trimming is clearing debris from the area, , 1221513];,# of Outages: 5,Customers Affected: 39,2022-07-28T04:29:31Z
events[1]=[064,07/27/2022 11:20 PM, 07/27/2022 11:20 PM, The extent of the outage has been determined, , 1221515];,# of Outages: 5,Customers Affected: 39,2022-07-28T04:29:31Z
events[2]=[072,07/27/2022 08:46 PM, 07/27/2022 08:46 PM, A crew is currently working on the problem, 07/28/2022 02:30 AM, 1221511];,# of Outages: 5,Customers Affected: 39,2022-07-28T04:29:31Z
events[3]=[073,07/27/2022 07:04 PM, 07/27/2022 07:04 PM, Tree Trimming is clearing debris from the area, , 1221497];,# of Outages: 5,Customers Affected: 39,2022-07-28T04:29:31Z
events[4]=[097,07/27/2022 06:14 PM, 07/27/2022 06:14 PM, A crew is currently working on the problem, 07/27/2022 11:30 PM, 1221491];,# of Outages: 5,Customers Affected: 39,2022-07-28T04:29:31Z
