V1,V2,V3,V4,V5,V6,outage_num,cust_affected,time
events[0]=[051,11/20/2022 02:21 AM, 11/20/2022 02:21 AM, A crew is currently working on the problem, 11/20/2022 12:00 PM, 1240290];,# of Outages: 4,Customers Affected: 82,2022-11-20T17:31:47Z
events[1]=[052,11/20/2022 02:21 AM, 11/20/2022 02:21 AM, A crew is currently working on the problem, 11/20/2022 12:00 PM, 1240290];,# of Outages: 4,Customers Affected: 82,2022-11-20T17:31:47Z
events[2]=[085,11/20/2022 11:14 AM, 11/20/2022 11:14 AM, The extent of the outage has been determined, , 1240307];,# of Outages: 4,Customers Affected: 82,2022-11-20T17:31:47Z
events[3]=[086,11/20/2022 11:01 AM, 11/20/2022 11:01 AM, Customer Svc is working this single customer outage, , 1240305];,# of Outages: 4,Customers Affected: 82,2022-11-20T17:31:47Z
events[4]=[098,11/20/2022 11:06 AM, 11/20/2022 11:06 AM, Trouble Shooter is determining repairs required, , 1240306];,# of Outages: 4,Customers Affected: 82,2022-11-20T17:31:47Z
