V1,V2,V3,V4,V5,V6,outage_num,cust_affected,time
events[0]=[017,11/16/2022 10:10 AM, 11/16/2022 10:10 AM, A crew is currently working on the problem, 11/16/2022 04:30 PM, 1239846];,# of Outages: 7,Customers Affected: 44,2022-11-16T22:21:20Z
events[1]=[071,11/16/2022 01:26 PM, 11/16/2022 01:26 PM, Tree Trimming is clearing debris from the area, , 1239862];,# of Outages: 7,Customers Affected: 44,2022-11-16T22:21:20Z
events[2]=[071,11/16/2022 12:50 PM, 11/16/2022 12:50 PM, Tree Trimming is clearing debris from the area, , 1239854];,# of Outages: 7,Customers Affected: 44,2022-11-16T22:21:20Z
events[3]=[087,11/16/2022 03:22 PM, 11/16/2022 03:22 PM, Customer Svc is working this single customer outage, , 1239872];,# of Outages: 7,Customers Affected: 44,2022-11-16T22:21:20Z
events[4]=[089,11/16/2022 03:25 PM, 11/16/2022 03:25 PM, Trouble Shooter is determining repairs required, , 1239875];,# of Outages: 7,Customers Affected: 44,2022-11-16T22:21:20Z
events[5]=[098,11/16/2022 03:12 PM, 11/16/2022 03:12 PM, Customer Svc is working this single customer outage, , 1239869];,# of Outages: 7,Customers Affected: 44,2022-11-16T22:21:20Z
events[6]=[102,11/16/2022 04:08 PM, 11/16/2022 04:08 PM, The extent of the outage has been determined, , 1239878];,# of Outages: 7,Customers Affected: 44,2022-11-16T22:21:20Z
