V1,V2,V3,V4,V5,V6,outage_num,cust_affected,time
events[0]=[071,04/16/2022 09:19 AM, 04/16/2022 09:19 AM, Trouble Shooter is determining repairs required, , 1202386];,# of Outages: 5,Customers Affected: 13,2022-04-16T14:31:19Z
events[1]=[072,04/16/2022 09:16 AM, 04/16/2022 09:16 AM, Customer Svc is working this single customer outage, , 1202385];,# of Outages: 5,Customers Affected: 13,2022-04-16T14:31:19Z
events[2]=[103,04/16/2022 05:25 AM, 04/16/2022 05:25 AM, A crew is currently working on the problem, 04/16/2022 01:00 PM, 1202377];,# of Outages: 5,Customers Affected: 13,2022-04-16T14:31:19Z
events[3]=[103,04/16/2022 05:26 AM, 04/16/2022 05:26 AM, A crew is currently working on the problem, 04/16/2022 01:00 PM, 1202378];,# of Outages: 5,Customers Affected: 13,2022-04-16T14:31:19Z
events[4]=[103,04/16/2022 05:26 AM, 04/16/2022 05:26 AM, A crew is currently working on the problem, 04/16/2022 01:00 PM, 1202379];,# of Outages: 5,Customers Affected: 13,2022-04-16T14:31:19Z
