V1,V2,V3,V4,V5,V6,outage_num,cust_affected,time
events[0]=[061,06/18/2022 04:54 PM, 06/18/2022 04:54 PM, A crew is currently working on the problem, 06/18/2022 06:30 PM, 1214875];,# of Outages: 5,Customers Affected: 24,2022-06-18T22:32:38Z
events[1]=[064,06/18/2022 03:45 PM, 06/18/2022 03:45 PM, Customer Svc is working this single customer outage, , 1214869];,# of Outages: 5,Customers Affected: 24,2022-06-18T22:32:38Z
events[2]=[082,06/18/2022 04:52 PM, 06/18/2022 04:52 PM, Trouble Shooter is determining repairs required, , 1214874];,# of Outages: 5,Customers Affected: 24,2022-06-18T22:32:38Z
events[3]=[099,06/18/2022 05:21 PM, 06/18/2022 05:21 PM, Waiting to be analyzed, , 1214877];,# of Outages: 5,Customers Affected: 24,2022-06-18T22:32:38Z
events[4]=[101,06/18/2022 03:53 PM, 06/18/2022 03:53 PM, Waiting for an available crew to perform repairs, , 1214870];,# of Outages: 5,Customers Affected: 24,2022-06-18T22:32:38Z
