V1,V2,V3,V4,V5,V6,outage_num,cust_affected,time
events[0]=[072,08/07/2022 12:42 PM, 08/07/2022 12:42 PM, Customer Svc is working this single customer outage, , 1223827];,# of Outages: 5,Customers Affected: 51,2022-08-07T18:47:39Z
events[1]=[084,08/07/2022 12:02 PM, 08/07/2022 12:02 PM, A crew is currently working on the problem, 08/07/2022 03:00 PM, 1223825];,# of Outages: 5,Customers Affected: 51,2022-08-07T18:47:39Z
events[2]=[085,08/07/2022 01:04 PM, 08/07/2022 01:04 PM, Trouble Shooter is determining repairs required, , 1223829];,# of Outages: 5,Customers Affected: 51,2022-08-07T18:47:39Z
events[3]=[086,08/07/2022 01:04 PM, 08/07/2022 01:04 PM, Trouble Shooter is determining repairs required, , 1223829];,# of Outages: 5,Customers Affected: 51,2022-08-07T18:47:39Z
events[4]=[090,08/07/2022 05:59 AM, 08/07/2022 05:59 AM, A crew is currently working on the problem, 08/07/2022 04:30 PM, 1223817];,# of Outages: 5,Customers Affected: 51,2022-08-07T18:47:39Z
events[5]=[098,07/31/2022 04:18 PM, 07/31/2022 04:18 PM, Waiting to be analyzed, , 1223032];,# of Outages: 5,Customers Affected: 51,2022-08-07T18:47:39Z
