V1,V2,V3,V4,V5,V6,outage_num,cust_affected,time
events[0]=[052,09/05/2022 07:37 AM, 09/05/2022 07:37 AM, A crew is currently working on the problem, 09/05/2022 06:00 PM, 1228362];,# of Outages: 8,Customers Affected: 162,2022-09-05T21:53:51Z
events[1]=[053,09/05/2022 07:37 AM, 09/05/2022 07:37 AM, A crew is currently working on the problem, 09/05/2022 06:00 PM, 1228362];,# of Outages: 8,Customers Affected: 162,2022-09-05T21:53:51Z
events[2]=[056,09/05/2022 04:47 PM, 09/05/2022 04:47 PM, Waiting to be analyzed, , 1228442];,# of Outages: 8,Customers Affected: 162,2022-09-05T21:53:51Z
events[3]=[063,09/05/2022 04:36 PM, 09/05/2022 04:36 PM, Customer Svc is working this single customer outage, , 1228439];,# of Outages: 8,Customers Affected: 162,2022-09-05T21:53:51Z
events[4]=[063,09/05/2022 04:40 PM, 09/05/2022 04:40 PM, The extent of the outage has been determined, , 1228441];,# of Outages: 8,Customers Affected: 162,2022-09-05T21:53:51Z
events[5]=[071,09/05/2022 03:21 PM, 09/05/2022 03:21 PM, Waiting for an available crew to perform repairs, , 1228434];,# of Outages: 8,Customers Affected: 162,2022-09-05T21:53:51Z
events[6]=[073,09/05/2022 04:02 PM, 09/05/2022 04:02 PM, Tree Trimming is clearing debris from the area, , 1228438];,# of Outages: 8,Customers Affected: 162,2022-09-05T21:53:51Z
events[7]=[077,09/05/2022 03:28 PM, 09/05/2022 03:28 PM, Customer Svc is working this single customer outage, , 1228437];,# of Outages: 8,Customers Affected: 162,2022-09-05T21:53:51Z
events[8]=[118,09/05/2022 09:37 AM, 09/05/2022 09:37 AM, A crew is currently working on the problem, 09/05/2022 08:00 PM, 1228407];,# of Outages: 8,Customers Affected: 162,2022-09-05T21:53:51Z
