V1,V2,V3,V4,V5,V6,outage_num,cust_affected,time
events[0]=[059,07/25/2022 05:14 PM, 07/25/2022 05:14 PM, The extent of the outage has been determined, , 1221207];,# of Outages: 7,Customers Affected: 80,2022-07-25T22:21:03Z
events[1]=[073,07/25/2022 03:01 PM, 07/25/2022 03:01 PM, Waiting for an available crew to perform repairs, , 1221197];,# of Outages: 7,Customers Affected: 80,2022-07-25T22:21:03Z
events[2]=[074,07/25/2022 04:46 PM, 07/25/2022 04:46 PM, Customer Svc is working this single customer outage, , 1221206];,# of Outages: 7,Customers Affected: 80,2022-07-25T22:21:03Z
events[3]=[085,07/25/2022 03:58 PM, 07/25/2022 03:58 PM, Customer Svc is working this single customer outage, , 1221202];,# of Outages: 7,Customers Affected: 80,2022-07-25T22:21:03Z
events[4]=[087,07/25/2022 01:56 PM, 07/25/2022 01:56 PM, Tree Trimming is clearing debris from the area, 07/25/2022 05:30 PM, 1221173];,# of Outages: 7,Customers Affected: 80,2022-07-25T22:21:03Z
events[5]=[089,07/25/2022 02:05 PM, 07/25/2022 02:05 PM, A crew is currently working on the problem, 07/25/2022 04:00 PM, 1221176];,# of Outages: 7,Customers Affected: 80,2022-07-25T22:21:03Z
events[6]=[114,07/25/2022 05:14 PM, 07/25/2022 05:14 PM, Waiting to be analyzed, , 1221208];,# of Outages: 7,Customers Affected: 80,2022-07-25T22:21:03Z
