V1,V2,V3,V4,V5,V6,outage_num,cust_affected,time
events[0]=[083,11/23/2022 04:08 PM, 11/23/2022 04:08 PM, A crew is currently working on the problem, 11/23/2022 09:30 PM, 1240627];,# of Outages: 5,Customers Affected: 70,2022-11-23T22:53:42Z
events[1]=[083,11/23/2022 04:41 PM, 11/23/2022 04:41 PM, A crew is currently working on the problem, 11/23/2022 09:30 PM, 1240628];,# of Outages: 5,Customers Affected: 70,2022-11-23T22:53:42Z
events[2]=[087,11/23/2022 03:29 PM, 11/23/2022 03:29 PM, Customer Svc is working this single customer outage, , 1240625];,# of Outages: 5,Customers Affected: 70,2022-11-23T22:53:42Z
events[3]=[097,11/23/2022 04:41 PM, 11/23/2022 04:41 PM, A crew is currently working on the problem, 11/23/2022 09:30 PM, 1240628];,# of Outages: 5,Customers Affected: 70,2022-11-23T22:53:42Z
events[4]=[102,11/23/2022 04:41 PM, 11/23/2022 04:41 PM, The extent of the outage has been determined, , 1240629];,# of Outages: 5,Customers Affected: 70,2022-11-23T22:53:42Z
events[5]=[114,11/23/2022 04:44 PM, 11/23/2022 04:44 PM, Waiting for an available crew to perform repairs, , 1240630];,# of Outages: 5,Customers Affected: 70,2022-11-23T22:53:42Z
