V1,V2,V3,V4,V5,V6,outage_num,cust_affected,time
events[0]=[060,11/24/2022 06:48 PM, 11/24/2022 06:48 PM, Tree Trimming is clearing debris from the area, , 1240777];,# of Outages: 6,Customers Affected: 182,2022-11-25T03:38:32Z
events[1]=[071,11/24/2022 08:57 PM, 11/24/2022 08:57 PM, Customer Svc is working this single customer outage, , 1240808];,# of Outages: 6,Customers Affected: 182,2022-11-25T03:38:32Z
events[2]=[072,11/24/2022 05:11 PM, 11/24/2022 05:11 PM, Waiting for an available crew to perform repairs, , 1240768];,# of Outages: 6,Customers Affected: 182,2022-11-25T03:38:32Z
events[3]=[077,11/24/2022 07:09 PM, 11/24/2022 07:09 PM, A crew is currently working on the problem, 11/24/2022 10:30 PM, 1240795];,# of Outages: 6,Customers Affected: 182,2022-11-25T03:38:32Z
events[4]=[086,11/24/2022 03:32 PM, 11/24/2022 03:32 PM, Waiting for an available crew to perform repairs, , 1240717];,# of Outages: 6,Customers Affected: 182,2022-11-25T03:38:32Z
events[5]=[119,11/24/2022 02:44 PM, 11/24/2022 02:44 PM, A crew is currently working on the problem, 11/24/2022 09:00 PM, 1240714];,# of Outages: 6,Customers Affected: 182,2022-11-25T03:38:32Z
