V1,V2,V3,V4,V5,V6,outage_num,cust_affected,time
events[0]=[072,05/07/2022 10:13 PM, 05/07/2022 10:13 PM, Waiting to be analyzed, , 1205820];,# of Outages: 6,Customers Affected: 27,2022-05-08T03:18:02Z
events[1]=[098,05/07/2022 08:19 PM, 05/07/2022 08:19 PM, Waiting for an available crew to perform repairs, , 1205815];,# of Outages: 6,Customers Affected: 27,2022-05-08T03:18:02Z
events[2]=[101,05/07/2022 02:49 PM, 05/07/2022 02:49 PM, A crew is currently working on the problem, 05/07/2022 11:30 PM, 1205801];,# of Outages: 6,Customers Affected: 27,2022-05-08T03:18:02Z
events[3]=[113,05/07/2022 02:23 PM, 05/07/2022 02:23 PM, Customer Svc is working this single customer outage, , 1205799];,# of Outages: 6,Customers Affected: 27,2022-05-08T03:18:02Z
events[4]=[114,05/07/2022 09:00 PM, 05/07/2022 09:00 PM, A crew is currently working on the problem, 05/08/2022 12:30 AM, 1205817];,# of Outages: 6,Customers Affected: 27,2022-05-08T03:18:02Z
events[5]=[114,05/07/2022 09:19 PM, 05/07/2022 09:19 PM, A crew is currently working on the problem, 05/08/2022 12:30 AM, 1205818];,# of Outages: 6,Customers Affected: 27,2022-05-08T03:18:02Z
