V1,V2,V3,V4,V5,V6,outage_num,cust_affected,time
events[0]=[075,05/23/2022 08:17 PM, 05/23/2022 08:17 PM, A crew is currently working on the problem, 05/23/2022 09:30 PM, 1209082];,# of Outages: 8,Customers Affected: 21,2022-05-24T01:56:25Z
events[1]=[084,05/23/2022 12:48 PM, 05/23/2022 12:48 PM, Waiting for an available crew to perform repairs, , 1209036];,# of Outages: 8,Customers Affected: 21,2022-05-24T01:56:25Z
events[2]=[085,05/23/2022 06:45 PM, 05/23/2022 06:45 PM, Trouble Shooter is determining repairs required, , 1209076];,# of Outages: 8,Customers Affected: 21,2022-05-24T01:56:25Z
events[3]=[097,05/23/2022 04:36 PM, 05/23/2022 04:36 PM, Customer Svc is working this single customer outage, , 1209061];,# of Outages: 8,Customers Affected: 21,2022-05-24T01:56:25Z
events[4]=[098,05/23/2022 10:40 AM, 05/23/2022 10:40 AM, A crew is currently working on the problem, 05/23/2022 09:00 PM, 1209019];,# of Outages: 8,Customers Affected: 21,2022-05-24T01:56:25Z
events[5]=[101,05/23/2022 04:43 PM, 05/23/2022 04:43 PM, Waiting for an available crew to perform repairs, , 1209064];,# of Outages: 8,Customers Affected: 21,2022-05-24T01:56:25Z
events[6]=[101,05/23/2022 06:26 PM, 05/23/2022 06:26 PM, A crew is currently working on the problem, 05/23/2022 09:30 PM, 1209072];,# of Outages: 8,Customers Affected: 21,2022-05-24T01:56:25Z
events[7]=[101,05/23/2022 06:36 PM, 05/23/2022 06:36 PM, Tree Trimming is clearing debris from the area, , 1209073];,# of Outages: 8,Customers Affected: 21,2022-05-24T01:56:25Z
