V1,V2,V3,V4,V5,V6,outage_num,cust_affected,time
events[0]=[051,11/17/2022 04:09 PM, 11/17/2022 04:09 PM, A crew is currently working on the problem, 11/17/2022 07:30 PM, 1240035];,# of Outages: 5,Customers Affected: 8,2022-11-17T23:43:16Z
events[1]=[052,11/17/2022 04:19 PM, 11/17/2022 04:19 PM, Trouble Shooter is determining repairs required, , 1240039];,# of Outages: 5,Customers Affected: 8,2022-11-17T23:43:16Z
events[2]=[052,11/17/2022 05:05 PM, 11/17/2022 05:05 PM, Trouble Shooter is determining repairs required, , 1240041];,# of Outages: 5,Customers Affected: 8,2022-11-17T23:43:16Z
events[3]=[062,11/17/2022 05:26 PM, 11/17/2022 05:26 PM, Customer Svc is working this single customer outage, , 1240044];,# of Outages: 5,Customers Affected: 8,2022-11-17T23:43:16Z
events[4]=[099,11/17/2022 05:16 PM, 11/17/2022 05:16 PM, A crew is currently working on the problem, 11/17/2022 08:30 PM, 1240042];,# of Outages: 5,Customers Affected: 8,2022-11-17T23:43:16Z
