V1,V2,V3,V4,V5,V6,outage_num,cust_affected,time
events[0]=[053,03/08/2022 04:34 PM, 03/08/2022 04:34 PM, Trouble Shooter is determining repairs required, , 1195373];,# of Outages: 5,Customers Affected: 73,2022-03-09T00:36:43Z
events[1]=[073,03/08/2022 03:11 PM, 03/08/2022 03:11 PM, Waiting for an available crew to perform repairs, , 1195358];,# of Outages: 5,Customers Affected: 73,2022-03-09T00:36:43Z
events[2]=[075,03/08/2022 02:04 PM, 03/08/2022 02:04 PM, Trouble Shooter is determining repairs required, , 1195228];,# of Outages: 5,Customers Affected: 73,2022-03-09T00:36:43Z
events[3]=[114,03/08/2022 03:31 PM, 03/08/2022 03:31 PM, A crew is currently working on the problem, 03/08/2022 09:00 PM, 1195360];,# of Outages: 5,Customers Affected: 73,2022-03-09T00:36:43Z
events[4]=[114,03/08/2022 03:34 PM, 03/08/2022 03:34 PM, A crew is currently working on the problem, 03/08/2022 09:00 PM, 1195363];,# of Outages: 5,Customers Affected: 73,2022-03-09T00:36:43Z
