V1,V2,V3,V4,V5,V6,outage_num,cust_affected,time
events[0]=[073,08/14/2022 12:30 PM, 08/14/2022 12:30 PM, A crew is currently working on the problem, , 1225427];,# of Outages: 7,Customers Affected: 117,2022-08-14T21:41:42Z
events[1]=[086,08/14/2022 02:16 PM, 08/14/2022 02:16 PM, Waiting for an available crew to perform repairs, , 1225429];,# of Outages: 7,Customers Affected: 117,2022-08-14T21:41:42Z
events[2]=[086,08/14/2022 04:34 PM, 08/14/2022 04:34 PM, The extent of the outage has been determined, , 1225433];,# of Outages: 7,Customers Affected: 117,2022-08-14T21:41:42Z
events[3]=[098,07/31/2022 04:18 PM, 07/31/2022 04:18 PM, Waiting to be analyzed, , 1223032];,# of Outages: 7,Customers Affected: 117,2022-08-14T21:41:42Z
events[4]=[101,08/14/2022 02:20 PM, 08/14/2022 02:20 PM, Customer Svc is working this single customer outage, , 1225430];,# of Outages: 7,Customers Affected: 117,2022-08-14T21:41:42Z
events[5]=[113,08/14/2022 06:40 AM, 08/14/2022 06:40 AM, A crew is currently working on the problem, 08/14/2022 08:00 PM, 1225411];,# of Outages: 7,Customers Affected: 117,2022-08-14T21:41:42Z
events[6]=[114,08/14/2022 03:26 PM, 08/14/2022 03:26 PM, Trouble Shooter is determining repairs required, , 1225432];,# of Outages: 7,Customers Affected: 117,2022-08-14T21:41:42Z
