V1,V2,V3,V4,V5,V6,outage_num,cust_affected,time
events[0]=[051,11/20/2022 02:21 AM, 11/20/2022 02:21 AM, A crew is currently working on the problem, 11/20/2022 10:00 AM, 1240290];,# of Outages: 4,Customers Affected: 129,2022-11-20T15:53:37Z
events[1]=[052,11/20/2022 02:21 AM, 11/20/2022 02:21 AM, A crew is currently working on the problem, 11/20/2022 10:00 AM, 1240290];,# of Outages: 4,Customers Affected: 129,2022-11-20T15:53:37Z
events[2]=[070,11/20/2022 09:46 AM, 11/20/2022 09:46 AM, Waiting to be analyzed, , 1240302];,# of Outages: 4,Customers Affected: 129,2022-11-20T15:53:37Z
events[3]=[073,11/20/2022 07:22 AM, 11/20/2022 07:22 AM, Waiting to be analyzed, , 1240295];,# of Outages: 4,Customers Affected: 129,2022-11-20T15:53:37Z
events[4]=[093,11/20/2022 08:50 AM, 11/20/2022 08:50 AM, Waiting for an available crew to perform repairs, , 1240299];,# of Outages: 4,Customers Affected: 129,2022-11-20T15:53:37Z
