V1,V2,V3,V4,V5,V6,outage_num,cust_affected,time
events[0]=[030,05/28/2022 08:33 AM, 05/28/2022 08:33 AM, Waiting for an available crew to perform repairs, , 1209751];,# of Outages: 5,Customers Affected: 78,2022-05-28T18:49:02Z
events[1]=[050,05/28/2022 11:32 AM, 05/28/2022 11:32 AM, Trouble Shooter is determining repairs required, , 1209761];,# of Outages: 5,Customers Affected: 78,2022-05-28T18:49:02Z
events[2]=[051,05/28/2022 01:04 PM, 05/28/2022 01:04 PM, Waiting for an available crew to perform repairs, , 1209767];,# of Outages: 5,Customers Affected: 78,2022-05-28T18:49:02Z
events[3]=[071,05/28/2022 01:39 PM, 05/28/2022 01:39 PM, The extent of the outage has been determined, , 1209769];,# of Outages: 5,Customers Affected: 78,2022-05-28T18:49:02Z
events[4]=[113,05/28/2022 12:16 PM, 05/28/2022 12:16 PM, Trouble Shooter is determining repairs required, , 1209763];,# of Outages: 5,Customers Affected: 78,2022-05-28T18:49:02Z
