V1,V2,V3,V4,V5,V6,outage_num,cust_affected,time
events[0]=[049,06/25/2022 05:37 AM, 06/25/2022 05:37 AM, Trouble Shooter is determining repairs required, , 1215616];,# of Outages: 5,Customers Affected: 59,2022-06-25T11:53:25Z
events[1]=[066,06/24/2022 06:12 PM, 06/24/2022 06:12 PM, A crew is currently working on the problem, 06/25/2022 07:30 AM, 1215595];,# of Outages: 5,Customers Affected: 59,2022-06-25T11:53:25Z
events[2]=[086,06/25/2022 03:06 AM, 06/25/2022 03:06 AM, Tree Trimming is clearing debris from the area, , 1215614];,# of Outages: 5,Customers Affected: 59,2022-06-25T11:53:25Z
events[3]=[101,06/25/2022 06:40 AM, 06/25/2022 06:40 AM, The extent of the outage has been determined, , 1215619];,# of Outages: 5,Customers Affected: 59,2022-06-25T11:53:25Z
events[4]=[106,06/25/2022 06:39 AM, 06/25/2022 06:39 AM, The extent of the outage has been determined, , 1215618];,# of Outages: 5,Customers Affected: 59,2022-06-25T11:53:25Z
