V1,V2,V3,V4,V5,V6,outage_num,cust_affected,time
events[0]=[055,03/21/2022 11:48 PM, 03/21/2022 11:48 PM, Trouble Shooter is determining repairs required, , 1197298];,# of Outages: 8,Customers Affected: 152,2022-03-22T05:54:14Z
events[1]=[063,03/21/2022 09:32 AM, 03/21/2022 09:32 AM, Waiting for an available crew to perform repairs, , 1197207];,# of Outages: 8,Customers Affected: 152,2022-03-22T05:54:14Z
events[2]=[074,03/21/2022 08:40 PM, 03/21/2022 08:40 PM, Tree Trimming is clearing debris from the area, 03/22/2022 02:30 AM, 1197294];,# of Outages: 8,Customers Affected: 152,2022-03-22T05:54:14Z
events[3]=[084,03/21/2022 03:39 PM, 03/21/2022 03:39 PM, Trouble Shooter is determining repairs required, , 1197246];,# of Outages: 8,Customers Affected: 152,2022-03-22T05:54:14Z
events[4]=[086,03/21/2022 11:54 PM, 03/21/2022 11:54 PM, A crew is currently working on the problem, 03/22/2022 01:30 AM, 1197301];,# of Outages: 8,Customers Affected: 152,2022-03-22T05:54:14Z
events[5]=[086,03/21/2022 11:56 PM, 03/21/2022 11:56 PM, Trouble Shooter is determining repairs required, , 1197304];,# of Outages: 8,Customers Affected: 152,2022-03-22T05:54:14Z
events[6]=[115,03/21/2022 11:59 PM, 03/21/2022 11:59 PM, Customer Svc is working this single customer outage, , 1197305];,# of Outages: 8,Customers Affected: 152,2022-03-22T05:54:14Z
events[7]=[130,03/22/2022 12:13 AM, 03/22/2022 12:13 AM, Waiting for an available crew to perform repairs, , 1197306];,# of Outages: 8,Customers Affected: 152,2022-03-22T05:54:14Z
