V1,V2,V3,V4,V5,V6,outage_num,cust_affected,time
events[0]=[050,11/27/2022 09:29 PM, 11/27/2022 09:29 PM, Trouble Shooter is working on the problem, 11/28/2022 01:00 AM, 1241250];,# of Outages: 9,Customers Affected: 853,2022-11-28T03:44:16Z
events[1]=[054,11/27/2022 01:19 PM, 11/27/2022 01:19 PM, A crew is currently working on the problem, 11/27/2022 10:30 PM, 1241202];,# of Outages: 9,Customers Affected: 853,2022-11-28T03:44:16Z
events[2]=[061,11/27/2022 08:37 PM, 11/27/2022 08:37 PM, Customer Svc is working this single customer outage, , 1241237];,# of Outages: 9,Customers Affected: 853,2022-11-28T03:44:16Z
events[3]=[061,11/27/2022 09:34 PM, 11/27/2022 09:34 PM, Waiting to be analyzed, , 1241253];,# of Outages: 9,Customers Affected: 853,2022-11-28T03:44:16Z
events[4]=[072,11/27/2022 07:18 AM, 11/27/2022 07:18 AM, Waiting for an available crew to perform repairs, , 1241147];,# of Outages: 9,Customers Affected: 853,2022-11-28T03:44:16Z
events[5]=[073,11/27/2022 05:03 PM, 11/27/2022 05:03 PM, A crew is currently working on the problem, , 1241226];,# of Outages: 9,Customers Affected: 853,2022-11-28T03:44:16Z
events[6]=[099,11/27/2022 08:53 PM, 11/27/2022 08:53 PM, Trouble Shooter is determining repairs required, , 1241242];,# of Outages: 9,Customers Affected: 853,2022-11-28T03:44:16Z
events[7]=[106,11/27/2022 08:43 PM, 11/27/2022 08:43 PM, Waiting to be analyzed, , 1241238];,# of Outages: 9,Customers Affected: 853,2022-11-28T03:44:16Z
events[8]=[113,11/27/2022 09:07 AM, 11/27/2022 09:07 AM, A crew is currently working on the problem, 11/27/2022 11:30 PM, 1241177];,# of Outages: 9,Customers Affected: 853,2022-11-28T03:44:16Z
