V1,V2,V3,V4,V5,V6,outage_num,cust_affected,time
events[0]=[049,08/22/2022 02:35 AM, 08/22/2022 02:35 AM, Customer Svc is working this single customer outage, , 1226288];,# of Outages: 5,Customers Affected: 38,2022-08-22T07:53:24Z
events[1]=[066,08/22/2022 01:36 AM, 08/22/2022 01:36 AM, Trouble Shooter is determining repairs required, , 1226286];,# of Outages: 5,Customers Affected: 38,2022-08-22T07:53:24Z
events[2]=[066,08/22/2022 02:47 AM, 08/22/2022 02:47 AM, The extent of the outage has been determined, , 1226289];,# of Outages: 5,Customers Affected: 38,2022-08-22T07:53:24Z
events[3]=[074,08/22/2022 01:47 AM, 08/22/2022 01:47 AM, Trouble Shooter is determining repairs required, , 1226287];,# of Outages: 5,Customers Affected: 38,2022-08-22T07:53:24Z
events[4]=[114,08/21/2022 09:55 PM, 08/21/2022 09:55 PM, A crew is currently working on the problem, 08/22/2022 04:30 AM, 1226270];,# of Outages: 5,Customers Affected: 38,2022-08-22T07:53:24Z
