V1,V2,V3,V4,V5,V6,outage_num,cust_affected,time
events[0]=[050,06/23/2022 09:23 PM, 06/23/2022 09:23 PM, Tree Trimming is clearing debris from the area, , 1215502];,# of Outages: 6,Customers Affected: 31,2022-06-24T06:27:02Z
events[1]=[051,06/24/2022 01:21 AM, 06/24/2022 01:21 AM, Trouble Shooter is determining repairs required, , 1215511];,# of Outages: 6,Customers Affected: 31,2022-06-24T06:27:02Z
events[2]=[063,06/24/2022 12:59 AM, 06/24/2022 12:59 AM, A crew is currently working on the problem, 06/24/2022 02:00 AM, 1215509];,# of Outages: 6,Customers Affected: 31,2022-06-24T06:27:02Z
events[3]=[087,06/23/2022 10:28 PM, 06/23/2022 10:28 PM, Waiting to be analyzed, , 1215504];,# of Outages: 6,Customers Affected: 31,2022-06-24T06:27:02Z
events[4]=[087,06/23/2022 10:28 PM, 06/23/2022 10:28 PM, Trouble Shooter is determining repairs required, , 1215505];,# of Outages: 6,Customers Affected: 31,2022-06-24T06:27:02Z
events[5]=[087,06/24/2022 01:05 AM, 06/24/2022 01:05 AM, Customer Svc is working this single customer outage, , 1215510];,# of Outages: 6,Customers Affected: 31,2022-06-24T06:27:02Z
