V1,V2,V3,V4,V5,V6,outage_num,cust_affected,time
events[0]=[049,10/04/2022 03:14 PM, 10/04/2022 03:14 PM, Customer Svc is working this single customer outage, , 1233076];,# of Outages: 5,Customers Affected: 25,2022-10-04T20:31:36Z
events[1]=[064,10/04/2022 03:25 PM, 10/04/2022 03:25 PM, The extent of the outage has been determined, , 1233077];,# of Outages: 5,Customers Affected: 25,2022-10-04T20:31:36Z
events[2]=[072,10/04/2022 02:26 PM, 10/04/2022 02:26 PM, Trouble Shooter is determining repairs required, , 1233073];,# of Outages: 5,Customers Affected: 25,2022-10-04T20:31:36Z
events[3]=[085,10/04/2022 12:55 PM, 10/04/2022 12:55 PM, Customer Svc is working this single customer outage, , 1233065];,# of Outages: 5,Customers Affected: 25,2022-10-04T20:31:36Z
events[4]=[098,10/04/2022 03:08 PM, 10/04/2022 03:08 PM, Customer Svc is working this single customer outage, , 1233075];,# of Outages: 5,Customers Affected: 25,2022-10-04T20:31:36Z
