V1,V2,V3,V4,V5,V6,outage_num,cust_affected,time
events[0]=[050,07/25/2022 10:09 PM, 07/25/2022 10:09 PM, Tree Trimming is clearing debris from the area, , 1221227];,# of Outages: 5,Customers Affected: 74,2022-07-26T06:31:29Z
events[1]=[053,07/25/2022 09:41 PM, 07/25/2022 09:41 PM, A crew is currently working on the problem, 07/26/2022 03:00 AM, 1221226];,# of Outages: 5,Customers Affected: 74,2022-07-26T06:31:29Z
events[2]=[085,07/26/2022 12:52 AM, 07/26/2022 12:52 AM, Trouble Shooter is determining repairs required, , 1221231];,# of Outages: 5,Customers Affected: 74,2022-07-26T06:31:29Z
events[3]=[090,07/25/2022 11:54 PM, 07/25/2022 11:54 PM, Waiting for an available crew to perform repairs, , 1221229];,# of Outages: 5,Customers Affected: 74,2022-07-26T06:31:29Z
events[4]=[090,07/26/2022 12:54 AM, 07/26/2022 12:54 AM, A crew is currently working on the problem, 07/26/2022 01:30 AM, 1221232];,# of Outages: 5,Customers Affected: 74,2022-07-26T06:31:29Z
