V1,V2,V3,V4,V5,V6,outage_num,cust_affected,time
events[0]=[047,07/21/2022 12:38 PM, 07/21/2022 12:38 PM, Customer Svc is working this single customer outage, , 1220723];,# of Outages: 8,Customers Affected: 14,2022-07-21T22:53:51Z
events[1]=[062,07/21/2022 04:17 PM, 07/21/2022 04:17 PM, Trouble Shooter is determining repairs required, , 1220752];,# of Outages: 8,Customers Affected: 14,2022-07-21T22:53:51Z
events[2]=[065,07/21/2022 05:06 PM, 07/21/2022 05:06 PM, Trouble Shooter is determining repairs required, , 1220756];,# of Outages: 8,Customers Affected: 14,2022-07-21T22:53:51Z
events[3]=[070,07/21/2022 05:47 PM, 07/21/2022 05:47 PM, Waiting to be analyzed, , 1220758];,# of Outages: 8,Customers Affected: 14,2022-07-21T22:53:51Z
events[4]=[071,07/21/2022 03:07 PM, 07/21/2022 03:07 PM, A crew is currently working on the problem, , 1220738];,# of Outages: 8,Customers Affected: 14,2022-07-21T22:53:51Z
events[5]=[074,07/21/2022 12:47 PM, 07/21/2022 12:47 PM, A crew is currently working on the problem, 07/21/2022 07:00 PM, 1220726];,# of Outages: 8,Customers Affected: 14,2022-07-21T22:53:51Z
events[6]=[102,07/21/2022 03:38 PM, 07/21/2022 03:38 PM, Customer Svc is working this single customer outage, , 1220741];,# of Outages: 8,Customers Affected: 14,2022-07-21T22:53:51Z
events[7]=[122,07/21/2022 04:01 PM, 07/21/2022 04:01 PM, Waiting for an available crew to perform repairs, , 1220748];,# of Outages: 8,Customers Affected: 14,2022-07-21T22:53:51Z
