V1,V2,V3,V4,V5,V6,outage_num,cust_affected,time
events[0]=[009,11/11/2022 01:28 PM, 11/11/2022 01:28 PM, Trouble Shooter is determining repairs required, , 1239441];,# of Outages: 5,Customers Affected: 36,2022-11-11T19:39:46Z
events[1]=[061,11/11/2022 11:29 AM, 11/11/2022 11:29 AM, Waiting for an available crew to perform repairs, , 1239435];,# of Outages: 5,Customers Affected: 36,2022-11-11T19:39:46Z
events[2]=[073,11/11/2022 11:06 AM, 11/11/2022 11:06 AM, Trouble Shooter is determining repairs required, , 1239432];,# of Outages: 5,Customers Affected: 36,2022-11-11T19:39:46Z
events[3]=[083,11/11/2022 11:21 AM, 11/11/2022 11:21 AM, Customer Svc is working this single customer outage, , 1239433];,# of Outages: 5,Customers Affected: 36,2022-11-11T19:39:46Z
events[4]=[123,11/11/2022 11:42 AM, 11/11/2022 11:42 AM, Waiting for an available crew to perform repairs, , 1239437];,# of Outages: 5,Customers Affected: 36,2022-11-11T19:39:46Z
