V1,V2,V3,V4,V5,V6,outage_num,cust_affected,time
events[0]=[086,03/23/2022 12:04 AM, 03/23/2022 12:04 AM, Customer Svc is working this single customer outage, , 1197487];,# of Outages: 3,Customers Affected: 247,2022-03-23T05:53:30Z
events[1]=[098,03/22/2022 05:04 PM, 03/22/2022 05:04 PM, Waiting for an available crew to perform repairs, , 1197469];,# of Outages: 3,Customers Affected: 247,2022-03-23T05:53:30Z
events[2]=[114,03/22/2022 03:26 PM, 03/22/2022 03:26 PM, A crew is currently working on the problem, 03/23/2022 02:00 AM, 1197442];,# of Outages: 3,Customers Affected: 247,2022-03-23T05:53:30Z
events[3]=[115,03/22/2022 03:26 PM, 03/22/2022 03:26 PM, A crew is currently working on the problem, 03/23/2022 02:00 AM, 1197442];,# of Outages: 3,Customers Affected: 247,2022-03-23T05:53:30Z
events[4]=[130,03/22/2022 03:26 PM, 03/22/2022 03:26 PM, A crew is currently working on the problem, 03/23/2022 02:00 AM, 1197442];,# of Outages: 3,Customers Affected: 247,2022-03-23T05:53:30Z
