V1,V2,V3,V4,V5,V6,outage_num,cust_affected,time
events[0]=[017,10/09/2022 07:24 AM, 10/09/2022 07:24 AM, A crew is currently working on the problem, 10/09/2022 05:30 PM, 1233535];,# of Outages: 5,Customers Affected: 56,2022-10-09T20:49:11Z
events[1]=[087,10/09/2022 03:00 PM, 10/09/2022 03:00 PM, Trouble Shooter is determining repairs required, , 1233557];,# of Outages: 5,Customers Affected: 56,2022-10-09T20:49:11Z
events[2]=[098,10/09/2022 03:44 PM, 10/09/2022 03:44 PM, Waiting to be analyzed, , 1233559];,# of Outages: 5,Customers Affected: 56,2022-10-09T20:49:11Z
events[3]=[102,10/09/2022 03:32 PM, 10/09/2022 03:32 PM, Customer Svc is working this single customer outage, , 1233558];,# of Outages: 5,Customers Affected: 56,2022-10-09T20:49:11Z
events[4]=[107,10/09/2022 02:38 PM, 10/09/2022 02:38 PM, Customer Svc is working this single customer outage, , 1233556];,# of Outages: 5,Customers Affected: 56,2022-10-09T20:49:11Z
