V1,V2,V3,V4,V5,V6,outage_num,cust_affected,time
events[0]=[051,07/27/2022 08:34 AM, 07/27/2022 08:34 AM, A crew is currently working on the problem, 07/27/2022 03:00 PM, 1221347];,# of Outages: 7,Customers Affected: 38,2022-07-27T20:22:41Z
events[1]=[051,07/27/2022 08:38 AM, 07/27/2022 08:38 AM, A crew is currently working on the problem, 07/27/2022 03:00 PM, 1221348];,# of Outages: 7,Customers Affected: 38,2022-07-27T20:22:41Z
events[2]=[074,07/27/2022 02:16 PM, 07/27/2022 02:16 PM, Trouble Shooter is determining repairs required, , 1221393];,# of Outages: 7,Customers Affected: 38,2022-07-27T20:22:41Z
events[3]=[084,07/27/2022 01:17 PM, 07/27/2022 01:17 PM, Tree Trimming is clearing debris from the area, , 1221385];,# of Outages: 7,Customers Affected: 38,2022-07-27T20:22:41Z
events[4]=[107,07/27/2022 02:45 PM, 07/27/2022 02:45 PM, Waiting for an available crew to perform repairs, , 1221396];,# of Outages: 7,Customers Affected: 38,2022-07-27T20:22:41Z
events[5]=[112,07/27/2022 02:28 PM, 07/27/2022 02:28 PM, Customer Svc is working this single customer outage, , 1221394];,# of Outages: 7,Customers Affected: 38,2022-07-27T20:22:41Z
events[6]=[114,07/27/2022 03:14 PM, 07/27/2022 03:14 PM, Waiting to be analyzed, , 1221397];,# of Outages: 7,Customers Affected: 38,2022-07-27T20:22:41Z
