V1,V2,V3,V4,V5,V6,outage_num,cust_affected,time
events[0]=[048,08/14/2022 01:22 AM, 08/14/2022 01:22 AM, Customer Svc is working this single customer outage, , 1225395];,# of Outages: 5,Customers Affected: 26,2022-08-14T06:57:38Z
events[1]=[085,08/13/2022 05:49 PM, 08/13/2022 05:49 PM, A crew is currently working on the problem, 08/14/2022 05:00 AM, 1225374];,# of Outages: 5,Customers Affected: 26,2022-08-14T06:57:38Z
events[2]=[098,07/31/2022 04:18 PM, 07/31/2022 04:18 PM, Waiting to be analyzed, , 1223032];,# of Outages: 5,Customers Affected: 26,2022-08-14T06:57:38Z
events[3]=[103,08/14/2022 01:49 AM, 08/14/2022 01:49 AM, Waiting to be analyzed, , 1225396];,# of Outages: 5,Customers Affected: 26,2022-08-14T06:57:38Z
events[4]=[103,08/14/2022 01:55 AM, 08/14/2022 01:55 AM, Waiting to be analyzed, , 1225397];,# of Outages: 5,Customers Affected: 26,2022-08-14T06:57:38Z
